{"$id":"urn:randle:r5:governed_enumeration","$schema":"https://json-schema.org/draft/2020-12/schema","additionalProperties":false,"properties":{"approved_direct_access_modules":{"items":false,"maxItems":2,"minItems":2,"prefixItems":[{"const":"governed_file_access_DRAFT.py"},{"const":"inventory_generator_DRAFT.py"}],"type":"array"},"authority_code_paths":{"items":false,"maxItems":7,"minItems":7,"prefixItems":[{"const":"Architecture/Audits/2026-07-21_Current_Production_Baseline_Capture_Boundary_Specification_DRAFT/governed_file_access_DRAFT.py"},{"const":"Architecture/Audits/2026-07-21_Current_Production_Baseline_Capture_Boundary_Specification_DRAFT/r5_authority_verifier_DRAFT.py"},{"const":"Architecture/Audits/2026-07-21_Current_Production_Baseline_Capture_Boundary_Specification_DRAFT/r5_enforcement_DRAFT.py"},{"const":"Architecture/Audits/2026-07-21_Current_Production_Baseline_Capture_Boundary_Specification_DRAFT/fixture_runner_R5_DRAFT.py"},{"const":"Architecture/Audits/2026-07-21_Current_Production_Baseline_Capture_Boundary_Specification_DRAFT/isolated_worker_R5_DRAFT.py"},{"const":"Architecture/Audits/2026-07-21_Current_Production_Baseline_Capture_Boundary_Specification_DRAFT/historical_parser_core_R5_DRAFT.py"},{"const":"Architecture/Audits/2026-07-21_Current_Production_Baseline_Capture_Boundary_Specification_DRAFT/comparison_engine_R5_DRAFT.py"}],"type":"array"},"authority_id":{"const":"R5-GOVERNED-CODE-ENUMERATION"},"schema_version":{"const":"7.0.0-DRAFT"}},"required":["schema_version","authority_id","authority_code_paths","approved_direct_access_modules"],"type":"object"}
