{"approved_direct_access_modules":["governed_file_access_DRAFT.py","inventory_generator_DRAFT.py"],"authority_code_paths":["Architecture/Audits/2026-07-21_Current_Production_Baseline_Capture_Boundary_Specification_DRAFT/governed_file_access_DRAFT.py","Architecture/Audits/2026-07-21_Current_Production_Baseline_Capture_Boundary_Specification_DRAFT/r5_authority_verifier_DRAFT.py","Architecture/Audits/2026-07-21_Current_Production_Baseline_Capture_Boundary_Specification_DRAFT/r5_enforcement_DRAFT.py","Architecture/Audits/2026-07-21_Current_Production_Baseline_Capture_Boundary_Specification_DRAFT/fixture_runner_R5_DRAFT.py","Architecture/Audits/2026-07-21_Current_Production_Baseline_Capture_Boundary_Specification_DRAFT/isolated_worker_R5_DRAFT.py","Architecture/Audits/2026-07-21_Current_Production_Baseline_Capture_Boundary_Specification_DRAFT/historical_parser_core_R5_DRAFT.py","Architecture/Audits/2026-07-21_Current_Production_Baseline_Capture_Boundary_Specification_DRAFT/comparison_engine_R5_DRAFT.py"],"authority_id":"R5-GOVERNED-CODE-ENUMERATION","schema_version":"7.0.0-DRAFT"}
